{
  "specversion": "1.0",
  "id": "01900000-0000-7000-8000-000000000030",
  "source": "ctxd://conformance",
  "subject": "/conformance/signed",
  "type": "demo",
  "time": "2026-01-01T00:03:00Z",
  "datacontenttype": "application/json",
  "data": {
    "msg": "hello"
  },
  "signature": "2a55be031ebed5d4c2da9929cacf56facc01ea19d8d7b1212513173f200767863b2008a3cdb282a20fe4b05082965d6002b34c6384254f3ae9460d07d6943f08"
}
